"Gene.Name","GENE.ID","rsIDs","Kept_rsIDs"
"APOE",348,"rs140269962; rs79074020; rs141739979; rs71352236; rs73936965; rs519113; rs11671274; rs11672399; rs393584; rs73556119; rs2075642; rs41290108; rs34278513; rs73556120; rs139777043; rs186890667; rs11665676; rs41290110; rs387976; rs3852859; rs369599; rs412776; rs370705; rs385982; rs73050293; rs11667640; rs419925; rs77196615; rs421812; rs3865427; rs11668861; rs150639620; rs144454647; rs3729640; rs6859; rs41290120; rs406456; rs3852860; rs11669338; rs73050302; rs11673139; rs3852861; rs71352237; rs34224078; rs35879138; rs577425827; rs143254941; rs41290122; rs183161720; rs148303016; rs11083749; rs406315; rs1985129; rs113743631; rs79701229; rs78754926; rs144261139; rs116967764; rs369077933; rs3745150; rs3745151; rs10420036; rs149450221; rs76725281; rs147636938; rs283808; rs283809; rs12972156; rs181518580; rs12972970; rs34342646; rs283810; rs283811; rs283813; rs283814; rs7254892; rs567906623; rs142934707; rs536833560; rs283815; rs41290128; rs373193858; rs145067941; rs6857; rs45438598; rs117310449; rs561654715; rs76692773; rs548069293; rs71352238; rs144590550; rs11556510; rs184017; rs78245864; rs157580; rs2075649; rs2075650; rs157581; rs73936968; rs34095326; rs151285748; rs34404554; rs11556505; rs157582; rs4803768; rs59007384; rs157584; rs77301115; rs73936970; rs1160983; rs112849259; rs182472499; rs157585; rs116881820; rs157588; rs11668327; rs157590; rs79398853; rs2238681; rs147707133; rs75687619; rs139399286; rs140684051; rs76366838; rs114536010; rs61679753; rs116874600; rs8106922; rs55821237; rs56290633; rs118170342; rs111784051; rs34878901; rs544092515; rs35568738; rs538813084; rs115881343; rs1160985; rs77100236; rs760136; rs1160984; rs142412517; rs73052321; rs741780; rs117264457; rs405697; rs116977783; rs112019714; rs1038025; rs1038026; rs149311267; rs141864196; rs1305062; rs117843462; rs10119; rs7256173; rs7259620; rs769446; rs405509; rs440446; rs769448; rs769449; rs769450; rs769452; rs429358; rs7412; rs1081105; rs1065853; rs1081106; rs75627662; rs72654472; rs72654473; rs439401; rs138235833; rs547648737; rs445925; rs10414043; rs7256200; rs72654437; rs483082; rs59325138; rs584007; rs438811; rs390082; rs72654445; rs72654447; rs66807996; rs72654449; rs12691088; rs5117; rs3826688; rs3925681; rs150966173; rs12721046; rs140480140; rs12721056; rs484195; rs12721051; rs1064725","rs79074020; rs141739979; rs71352236; rs393584; rs41290108; rs73050293; rs77196615; rs41290120; rs183161720; rs113743631; rs78754926; rs144261139; rs116967764; rs149450221; rs12972156; rs7254892; rs73936968; rs4803768; rs182472499; rs55821237; rs117264457; rs141864196; rs439401; rs138235833; rs72654445"
"BAALC",79870,"rs6983249; rs2454026; rs72669390; rs72669393; rs6983904; rs6983777; rs111310483; rs28709912; rs2454027; rs28763628; rs2515169; rs187280252; rs2515170; rs78442205; rs1587275; rs6468859; rs7824925; rs62527570; rs2515171; rs2515172; rs55668171; rs2454028; rs16870106; rs55734255; rs10111377; rs2515173; rs17202607; rs2047377; rs10109704; rs964166; rs1318739; rs33999374; rs35738184; rs4734070; rs13253566; rs16870120; rs138197150; rs983672; rs983673; rs72606694; rs983674; rs983675; rs10955304; rs12677471; rs16870122; rs16870125; rs1497453; rs12544792; rs1497454; rs62527571; rs78731560; rs1497455; rs75577249; rs116247334; rs13275878; rs6997977; rs10955305; rs16870133; rs16870134; rs186113668; rs6998787; rs7828800; rs7828931; rs76388338; rs7832497; rs146983172; rs74802095; rs11784399; rs10955306; rs10955307; rs9297330; rs2935592; rs10955308; rs2454031; rs1391116; rs1391117; rs74968497; rs145345762; rs28489785; rs144758423; rs185085487; rs185086590; rs62527572; rs73293931; rs71518902; rs2515175; rs2454032; rs2454033; rs558208763; rs116897288; rs56735886; rs2515176; rs60250210; rs2454034; rs2454035; rs2515177; rs2515178; rs62527573; rs7837010; rs4734687; rs2454036; rs2454037; rs76342329; rs2515179; rs2454038; rs62527574; rs3019158; rs2935593; rs145588635; rs3019159; rs76823172; rs527606768; rs7840976; rs74584355; rs75729837; rs1846063; rs1497450; rs2454000; rs2515181; rs7004923; rs2454001; rs2454002; rs2454003; rs9918836; rs2454004; rs2515182; rs2454005; rs2249256; rs2249255; rs2249254; rs62527598; rs6990544; rs2249240; rs2454006; rs2454007; rs60455429; rs953253; rs953254; rs1113126; rs953252; rs1976326; rs12677847; rs2132867; rs2388493; rs67864362; rs2246446; rs2388494; rs2515184; rs2246342; rs2246341; rs2246337; rs75373392; rs79288331; rs79956307; rs2515185; rs2515186; rs191183528; rs1497451; rs2515187; rs7836495; rs1846064; rs73293974; rs1846065; rs2454009; rs1497452; rs1391114; rs1391115; rs1113209; rs1113208; rs7011642; rs56178740; rs963599; rs141816267; rs28495148; rs28709120; rs10955309; rs2454011; rs11774996; rs2515188; rs28484802; rs182987046; rs79007595; rs9694453; rs535987585; rs569888588; rs72671341; rs1473541; rs62527601; rs7829807; rs192183249; rs78060396; rs7814399; rs72671342; rs62527602; rs2515189; rs576158740; rs3736042; rs142918591; rs2454012; rs77171774; rs80323671; rs12375277; rs145641918; rs56156301; rs72671346; rs149176675; rs186386946; rs62527603; rs62527604; rs115257086; rs150729627; rs75954597; rs62527605; rs6999246; rs2256164; rs6999622; rs117230303; rs7014008; rs7014597; rs138919262; rs77495104; rs62527606; rs3736043; rs62527607; rs72671356; rs72671357; rs2454013; rs2454014; rs188652258; rs1391118; rs1353629; rs62527608; rs62527609; rs62527610; rs6998012; rs76517019; rs2515190; rs62527611; rs62527612; rs10113728; rs2515191; rs138586380; rs991312; rs72671361; rs62527613; rs2935579; rs62527614; rs1874091; rs7014418; rs6468860; rs4734689; rs151007018; rs4734690; rs7001897; rs1497449; rs76443321; rs114885904; rs4734071; rs189235039; rs190975290; rs563667923; rs532341391; rs10100139; rs12545903; rs7002208; rs7836191; rs62527615; rs7006682; rs1874089; rs1874090; rs13259545; rs28672985; rs10955310; rs183189103; rs12056711; rs188120907; rs13274504; rs77852266; rs143381774; rs12335035; rs1494281; rs188982108; rs61274078; rs72671371; rs62527631; rs57787067; rs79933384; rs13262291; rs72507596; rs149357073; rs1845431; rs1845430; rs55912746; rs190981462; rs72671376; rs10088491; rs62527633; rs141277237; rs189707535; rs72671377; rs13264626; rs147082059; rs1494276; rs62527634; rs6468861; rs116888904; rs72671378; rs7819767; rs7820010; rs62527635; rs6994179; rs72671380; rs6994827; rs62527636; rs10111771; rs118057733; rs10112046; rs11787154; rs72671383; rs145862628; rs6468862; rs56409545; rs7009527; rs7839419; rs6468863; rs6468864; rs72671385; rs72671386; rs62527637; rs1494282; rs117692476; rs375483335; rs1389690; rs10099640; rs10955311; rs72671389; rs62527638; rs72671390; rs1826642; rs59216783; rs11779234; rs7843029; rs11779236; rs7843452; rs10481102; rs1497456; rs7829208; rs113970950; rs62527639; rs531908986; rs72671392; rs62527640; rs72671393; rs547616473; rs13258575; rs72671394; rs117355360; rs10955312; rs189941347; rs903296; rs903297; rs375979035; rs374572466; rs116378451; rs2388495; rs61607037; rs728909; rs9693655; rs10111507; rs16870210; rs567273014; rs1000460; rs138203127; rs1000461; rs72671401; rs62527643; rs72671402; rs13269490; rs16870221; rs954782; rs954783; rs72673304; rs72673306; rs140173198; rs62527644; rs72673308; rs17793351; rs76536534; rs72673311; rs116846911; rs62527645; rs12543973; rs12707776; rs138728873; rs10102706; rs10103004; rs111589128; rs16870227; rs72673313; rs62527646; rs62527647; rs7827695; rs13275933; rs35086518; rs550020579; rs56356799; rs149983164; rs140803498; rs16870228; rs182377243; rs16870229; rs13276105; rs185601319; rs6980600; rs140822704; rs144631885; rs36016728; rs7817115; rs1494271; rs6990135; rs1494272; rs6990484; rs1494273; rs62527649; rs16870235; rs75115719; rs78236054; rs62527650; rs78171567; rs3956319; rs1494274; rs72673319; rs4645535; rs713368; rs6997475; rs713369; rs62527651; rs6468865; rs10113161; rs62527652; rs75548816; rs72673322; rs13255734; rs144365486; rs6989822; rs28459744; rs56053090; rs1032470; rs17793532; rs28735228; rs1032469; rs73699741; rs117858094; rs56006114; rs16870240; rs6980795; rs184049848; rs75076333; rs12548629; rs28442007; rs78447942; rs149563372; rs112103150; rs111282809; rs13279226; rs141731836; rs138991450; rs55985336; rs4734692; rs113530935; rs16870243; rs16870245; rs34337822; rs7015757; rs16870249; rs13275173; rs62528473; rs11784151; rs7815503; rs1494277; rs565547444; rs10104097; rs72673324; rs17204757; rs74432265; rs567257569; rs111757062; rs56326423; rs79884240; rs144275578; rs13270175; rs4510824; rs28566705; rs117316543; rs79452741; rs143228563; rs569706892; rs72673325; rs62528474; rs13255229; rs10088427; rs72673327; rs144165051; rs6992681; rs192488921; rs34185273; rs144208068; rs78443393; rs62528478; rs78722260; rs7017690; rs114121490; rs1353213; rs17204975; rs72673331; rs1157213; rs11777754; rs78651620; rs77164515; rs117788791; rs147359601; rs2220825; rs72673333; rs28550135; rs13439041; rs114299415; rs188076910; rs7002269; rs1353212; rs62528479; rs75812634; rs1113413; rs28615644; rs112422787; rs76565016; rs60613695; rs996200; rs10110129; rs150525670; rs56047420; rs146373793; rs62525460; rs2201369; rs112762453; rs72673336; rs72673337; rs10097018; rs56666894; rs13277869; rs34602800; rs557212398; rs548439351; rs560515817; rs2201370; rs148215255; rs72673338; rs2220824; rs7825986; rs139666552; rs187735503; rs7001084; rs146149999; rs140035557; rs144697208; rs185022264; rs189008223; rs10089245; rs10104521; rs35710705; rs11782552; rs17799574; rs11782632; rs17799604; rs10096999; rs10097271; rs62525462; rs78203023; rs77004766; rs7817074; rs9656787; rs17205332; rs7829782; rs112634890; rs62525463; rs74339929; rs62525464; rs72673342; rs34893881; rs59299635; rs77810104; rs34111666; rs7844873; rs72673344; rs62525466; rs28380211; rs111320783; rs10100382; rs10103573; rs77388308; rs56323909; rs115940968; rs10107615; rs555612351; rs79699310; rs76964832; rs4734693; rs72673345; rs565052034; rs62525467; rs193054160; rs4002032; rs565919496; rs145619783; rs11554072; rs537190671; rs16870270; rs1032471; rs113692569; rs111458364; rs17205590; rs34612546; rs189249691; rs74899297; rs55852919; rs189723722; rs79115998; rs12543038; rs7002833; rs78470050; rs376255385; rs12541167; rs562293087; rs118158588; rs146518149; rs139790838; rs7013734; rs184065027; rs145511481; rs6468866; rs79688022; rs190386458; rs556579609; rs111532155; rs72673347; rs10102413; rs10089343; rs11781628; rs537209929; rs11785583; rs184570302; rs13263611; rs16870276; rs17205821; rs117067135; rs191987063; rs12156164; rs142498435; rs77128510; rs62525470","rs6983249; rs2454026; rs72669390; rs111310483; rs7824925; rs35738184; rs16870120; rs138197150; rs983672; rs983675; rs62527571; rs186113668; rs146983172; rs74802095; rs9297330; rs2935592; rs2454031; rs28489785; rs185086590; rs73293931; rs7837010; rs145588635; rs2454007; rs79956307; rs142918591; rs72671346; rs150729627; rs117230303; rs77495104; rs190981462; rs13258575; rs375979035; rs374572466; rs56006114; rs149563372; rs112103150; rs1494277; rs192488921; rs117788791; rs548439351; rs139666552; rs187735503; rs140035557; rs7829782; rs56323909; rs118158588"
"FKBP5",2289,"rs55832955; rs60645405; rs79270276; rs73746480; rs527778528; rs73746481; rs11961458; rs11966436; rs11961482; rs6909690; rs373503943; rs6457833; rs143110431; rs6932821; rs6932968; rs6933159; rs6910300; rs115436499; rs6910435; rs73746483; rs78002957; rs73746484; rs60867971; rs73746485; rs114825960; rs146455550; rs11962885; rs11967869; rs80225207; rs187182001; rs530209344; rs529169378; rs11967862; rs76243460; rs6457834; rs6457835; rs151191643; rs140520083; rs9296157; rs72913412; rs116384035; rs74335585; rs74853132; rs142728341; rs188193469; rs3800374; rs6929873; rs115636163; rs185658228; rs9380522; rs148558396; rs190413098; rs73746488; rs79479915; rs34196394; rs34981747; rs57634040; rs138276217; rs115611114; rs115188724; rs9470063; rs12055438; rs1043805; rs148611063; rs41270080; rs3800373; rs11545925; rs182051235; rs186224671; rs45586932; rs56002954; rs146787424; rs34866878; rs537244410; rs570771789; rs111375581; rs72913417; rs61188051; rs545468177; rs547778666; rs114356859; rs7757037; rs111674784; rs550694743; rs569024949; rs140458482; rs755658; rs73746490; rs74550485; rs59320339; rs184722766; rs7755289; rs180923765; rs77715420; rs73746491; rs186522188; rs16878591; rs73746492; rs73746493; rs57155120; rs77612799; rs73746494; rs2294807; rs992105; rs7766764; rs7771727; rs11758051; rs557267906; rs140730875; rs368049060; rs10498734; rs7754690; rs77962862; rs542432478; rs150647146; rs79321975; rs3798345; rs3798346; rs143098189; rs9366890; rs148775772; rs143268715; rs76042823; rs73746495; rs537569513; rs112917942; rs150380552; rs7753746; rs78596668; rs76787105; rs113805226; rs111499370; rs116566747; rs9296158; rs2395633; rs2395634; rs115408269; rs79149296; rs142525835; rs16878806; rs4713899; rs16878812; rs57744001; rs192979490; rs115061314; rs73746498; rs189185201; rs116782158; rs78685770; rs139111946; rs187956141; rs149903675; rs111311633; rs78144760; rs74709645; rs144360091; rs148757401; rs141686434; rs737054; rs11966198; rs72913423; rs10807152; rs147348090; rs76903358; rs142359398; rs9470067; rs190228034; rs188201665; rs181404974; rs113080387; rs142746190; rs530619609; rs73746499; rs3777747; rs6926133; rs114287508; rs6457836; rs75419538; rs114110413; rs547878354; rs58327994; rs189144592; rs193129738; rs73748203; rs72913427; rs76813839; rs9470069; rs149450199; rs4401662; rs200841782; rs141341237; rs73748204; rs144308686; rs12527893; rs79285437; rs9368878; rs143792469; rs747411; rs79773912; rs190183325; rs74682753; rs138381762; rs186304113; rs9380524; rs72921231; rs145994944; rs7754668; rs148754368; rs75118012; rs113805447; rs16879318; rs4713900; rs62402121; rs186403963; rs143055559; rs79134986; rs7748266; rs555843458; rs190824366; rs192086130; rs7743425; rs7747121; rs144714430; rs76212347; rs145374662; rs147241450; rs141064452; rs151301518; rs149697932; rs536906640; rs140278394; rs10947562; rs16879378; rs74636231; rs147258732; rs115266770; rs572784266; rs115267263; rs151086740; rs553233411; rs57985230; rs148898887; rs143572309; rs116962609; rs4713901; rs146471838; rs28675670; rs548504335; rs3798347; rs150820042; rs7740395; rs112754019; rs7760951; rs116022819; rs189730733; rs72921237; rs73417664; rs77113718; rs1591365; rs7746850; rs73748205; rs7751598; rs142079706; rs140419645; rs114918704; rs58873316; rs116196428; rs115014304; rs58767751; rs75445693; rs1360780; rs7763114; rs73748206; rs55922240; rs140140532; rs71569306; rs191157586; rs115187212; rs116771139; rs145464302; rs60103601; rs7756437; rs9348979; rs113065020; rs6902124; rs12110366; rs7740621; rs75950706; rs2143404; rs12527329; rs9394307; rs58549426; rs77455706; rs77187150; rs148128369; rs114283251; rs9767565; rs73748209; rs191072130; rs7771718; rs7771722; rs4713902; rs73748211; rs59595954; rs140656232; rs191878277; rs11963040; rs188632512; rs1334894; rs9462100; rs140982323; rs9357201; rs9357202; rs191016418; rs376933741; rs6912833; rs115825224; rs4713903; rs147140544; rs140253283; rs77571794; rs190200099; rs1475774; rs555193070; rs4544902; rs553290869; rs6931118; rs11754441; rs10456431; rs138860131; rs527429723; rs9394309; rs17614642; rs2092427; rs58312291; rs111378536; rs537273743; rs75904817; rs9296159; rs141720418; rs12197246; rs566044174; rs4713904; rs79476859; rs6929523; rs13215497; rs4711425; rs77253887; rs7775489; rs4713905; rs151038510; rs7747647; rs111927248; rs112972898; rs567089655; rs137977904; rs75710780; rs9380525; rs13192954; rs140241859; rs9368881; rs73417687; rs7752084; rs186252844; rs114623987; rs9368882; rs114559975; rs9394310; rs186996800; rs142423206; rs4713906; rs75477235; rs79218801; rs78196957; rs191907358; rs9470079; rs4713907; rs148234137; rs141473268; rs6931036; rs73748220; rs73748221; rs147241922; rs7758906; rs9470080; rs4713908; rs185290009; rs142989415; rs115403670; rs6457839; rs142232122; rs151229770; rs76019376; rs147614773; rs6899478; rs187790323; rs184757466; rs34110646; rs187624235; rs10947563; rs138926009; rs3800372; rs10947564; rs13215797; rs9462103; rs550246703; rs9380526; rs9368885; rs111867369; rs115745065; rs62402145; rs187208328; rs140576483; rs149722227; rs145541948; rs7759392; rs146257681; rs55987213; rs7763535; rs56311918; rs150456373; rs146952403; rs9380528; rs80179277; rs4713911; rs13340463; rs77319078; rs59520042; rs943297; rs138377791; rs12153967; rs145987281; rs183344228; rs574628030; rs9394311; rs113451273; rs541665267; rs188190968; rs59590692; rs9470082; rs4713915; rs144827927; rs371386293; rs4713916; rs375240273; rs12190582; rs6902321; rs7745324; rs2395635; rs10456432; rs184760557; rs9394312; rs13213010; rs116955080; rs9394313; rs9462104; rs9470084; rs9296160; rs191161449; rs55694295; rs6900592; rs9380529; rs6905674; rs183301018; rs6457842; rs4713918; rs4713919; rs4711426; rs4711427; rs77644320; rs114807361; rs78179295; rs58580399; rs144583297; rs4713920; rs4711428; rs34237662; rs143018638; rs6909804; rs75166219; rs57599664; rs4713921; rs73729766; rs190272427; rs9394314; rs4711429; rs2766532; rs550283494; rs2817031; rs73729767; rs138284128; rs2766533; rs2766534; rs12200498; rs143262325; rs6914554; rs6914582; rs73729770; rs9348981; rs191947602; rs111388699; rs77379145; rs147823312; rs2817032; rs7747780; rs77168471; rs12206670; rs13198515; rs114840894; rs146377667; rs138403494; rs113038897; rs189716239; rs78220087; rs114304008; rs4236047; rs2766535; rs139075369; rs74913227; rs12203716; rs115927448; rs76917354; rs77677939; rs10947565; rs75552415; rs7751693; rs74943948; rs2766536; rs528123977; rs28435135; rs2817033; rs2817035; rs45545133; rs2766537; rs77666918; rs111501272; rs186143918; rs1124347; rs2766538; rs145242097; rs183047956; rs114640518; rs529259707; rs115313559; rs2817037; rs150257485; rs45586442; rs2817038; rs77821345; rs116307714; rs182506790; rs368104989; rs114566803; rs144205183; rs2817039; rs56354119; rs12193672; rs2817040; rs151133317; rs2817041; rs150383656; rs9296162; rs562922660; rs148264570; rs1581858; rs1831030; rs1986782; rs2766541; rs11968757; rs73419752; rs2766542; rs74470085; rs2766543; rs73419754; rs6936778; rs9470086; rs4321818; rs78747147; rs2766544; rs111517175; rs2766545; rs75842115; rs1075092; rs1075091; rs67057477; rs67487310; rs532491495; rs140245550; rs2252881; rs112217683; rs61731466; rs115869154; rs111772535; rs139399426; rs2766547; rs2766548; rs113827034; rs116064474; rs115842444; rs141153256; rs2766549; rs2766550; rs145579198; rs2766551; rs138308084; rs113667265; rs2766553; rs112618909; rs2766554; rs114847732; rs77990875; rs74541241; rs73729784; rs142470651; rs60111605; rs142007140; rs2766555; rs185182749; rs7752049; rs2817044; rs7739014; rs12196319; rs57915701; rs2817045; rs2766556; rs2766557; rs139013645; rs2817046; rs2766558; rs151043380; rs7768547; rs58451984; rs2817047; rs4713923; rs2766559; rs2766560; rs2263331; rs143426188; rs79905650; rs138978260; rs9366891; rs58064198; rs2766561; rs2766562; rs2766563; rs369782815; rs372751247; rs2817048; rs9394316; rs2817049; rs6457848; rs66977204; rs58314845; rs2766564; rs79209092; rs2766565; rs55934044; rs9380532; rs55659005; rs55891449; rs2817050","rs55832955; rs143110431; rs6910300; rs114825960; rs146455550; rs74853132; rs34981747; rs138276217; rs115611114; rs78596668; rs142525835; rs115061314; rs74709645; rs530619609; rs62402121; rs79134986; rs112754019; rs140656232; rs111378536; rs79476859; rs13192954; rs151229770; rs62402145; rs58580399; rs144583297; rs2766533; rs77379145; rs115927448; rs2817038; rs9296162; rs562922660; rs111517175; rs139013645; rs151043380; rs79905650"
